{"approved":true,"candidate_ids":["JEV-35BF42296433"],"context_sha256":"8feb292d57ff31f8447e762a31743b597968a7fcc9447c1345e9b49113715769","contract":"repository-placement-review-v1","mode":"experimental","reason":"Prepare an experimental selection, not an implementation or activation.","resource_bounds":{"deadline_seconds":null,"max_calls_total":null,"max_cost_total_usd":null},"reviewer":"synthetic-demo-reviewer","schema_version":"1.0"}
